Date,News,Type of visualizaton,Content it is depicting,page no.(location),quadrant,width (columns),height (inch),colour/ b&w(treatment),photograph,illustrationDec-01,Crime capital: Delhi records 39% of offences in metros,stacked bar chart,crime,1,2,2,1.8,colour,no,yesDec-01,Economy shakes off DeMon & GST impact with 6.3% growth,line chart,economic,1,2,2,1.6,colour,no,noDec-01,"Double deck flyover, underpass to unclog city's worst 2 stretches","map, icons",development,2,"1, 2",4,3,colour,no,noDec-01,CityWeather,icons,weather,2,2,1,1.7,colour,no,noDec-01,Delhi accounted for 39% of crimes among metro cities,"bar chart, pie chart, jumbo figures",crime,4,"1, 2",3,5,colour,no,yesDec-01,Over 12000 picked to get DDA flats,"map, table",development,5,2,3,3.2,colour,yes,noDec-01,Pollution watch,"bar chart, colour",environment,5,"2, 3",1,5.8,colour,no,noDec-01,Indians most satisfied with their sex lives,"pie chart, ring chart, jumbo figures, bubble chart",lifestyle,7,"1, 2",4,4.7,colour,no,yesDec-01,Your 2-wheeler can also sport fancy number,"jumbo figures, list",transport,7,2,2,2,colour,yes,noDec-01,Desis 2nd biggest group to get US citizenship in '16,stacked bar chart,foreign affairs,10,2,2,2,colour,no,noDec-01,"Winter's here, but more ciites see improvement in air quality: CPCB",table,environment,12,2,2,4,colour,no,noDec-01,"Child rapes up 82% in 2016, UP records a 400% jump","bar chart, map, bubble chart",crime,19,2,3,3,colour,no,yesDec-01,"Delhi a full-fledged state, cannot compare it with metros: Top cop",bar chart,crime,19,2,1,2.8,colour,no,noDec-01,"2016 saw 106 rapes a day, Delhi the capital here too",pie chart,crime,19,1,2,1,colour,no,yesDec-01,Deceleration trend in growth has reversed,"stacked bar chart, icons",economic,24,1,2,3.2,colour,no,noDec-01,Pacers vs Spinners: on previous SA tour (2013-14),table,sports,25,1,1.5,2,colour,yes,noDec-01,Last Gasp sterling,table,sports,26,1,1.2,1.3,colour,yes,noDec-01,Citizen reporter,map,public opinion,2,1,2,9,colour,yes,noDec-01,Big Uber Hack: The Latest Data Heist to hit millions,jumbo figures,crime,2,4,4,1.5,colour,yes,noDec-02,CityWeather,icons,weather,2,2,1,1.7,colour,no,noDec-02,Solutions for 4.7 km Ring Road stretch,"map, list",development,2,1,3,4,colour,no,noDec-02,Delhi police self-defense campaign,table,campaign,2,3,4,2.5,colour,yes,noDec-02,"Every 12 hours, a murder in Delhi","table, icons, visual depiction of numbers",crime,4,2,3,4,colour,no,noDec-02,Traffic advisory,"map, icons",transport,4,"3, 4",5.5,7.5,colour,yes,noDec-02,Central law notified 5 years ago can check medical malpractices: Experts,"icons, list, jumbo figures",health,4,1,3,2,colour,no,noDec-02,Help stabs 73 year old woman in GK-1 for refusing to loan her Rs. 5 lakh,timeline,crime,6,2,3,2.5,colour,yes,noDec-02,Movie reviews,visual depiction of numbers,entertainment,6,"1, 2, 3, 4",2,1.2,colour,yes,noDec-02,Peek into city's only travelator outside IGI,"map, jumbo figures",development,8,"1, 2",4,4.8,colour,yes,noDec-02,Better off this November but still breathing poison,line chart,environment,9,1,3,2,colour,no,yesDec-02,Mfg activity strongest in 3 months,line chart,development,21,2,2,1.8,colour,no,noDec-02,Nov car sales rise in double digits,"table, bar chart",transport,21,3,2,1.5,colour,no,noDec-02,No open and shut case,jumbo figures,sports,23,"1, 2",1.5,6,colour,yes,noDec-02,Pink ball tussle,jumbo figures,sports,23,4,1,4,colour,yes,noDec-02,Decks cleared for roulette,list,sports,26,"1, 2",6,4,colour,yes,noDec-02,Home buyer alert! Sector 70 to 73 of Gurgaon offer good deals,map,development,59,"1, 2",4.5,7,colour,yes,noDec-02,Citizen reporter,map,public opinion,2,1,4,9,colour,yes,noDec-02,"Health, leisure and happy marriage as important as marriage","bar chart, pie chart",lifestyle,2,4,4,6,colour,yes,noDec-03,CityWeather,icons,weather,2,2,1,1.7,colour,no,noDec-03,Max may lose license if guilty: Jain,timeline,health,2,1,2,1.7,colour,yes,noDec-03,Delhi police self-defense campaign,table,campaign,2,4,4,2.7,colour,yes,noDec-03,Principals feel campaign will lead to more bright sparks,bubble chart,campaign,4,1,1.5,2.7,colour,no,noDec-03,Arid threat: Study finds Aravalis are losing power to check desert spread,"map, area chart",environment,4,2,3,3.2,colour,no,noDec-03,Movie reviews,visual depiction of numbers,entertainment,4,4,1.3,0.5,colour,yes,noDec-03,Graded plan reason why air is better this year,table,environment,7,2,1.6,1.7,colour,no,yesDec-03,"accidents, suicides, ailments kill 1600 soldiers every year","bar chart, bubble chart",health,10,"1, 2",3,2,colour,yes,noDec-03,How new-age enterpreneuers are homing in on old-economy hubs,process,development,18,3,2.5,1.5,colour,yes,yesDec-03,Deal of the week,jumbo figures,economic,18,4,2,2.5,colour,no,noDec-03,"With 8 times more sales, China's Singles Day makes Diwali look frugal","jumbo figures, bubble chart",economic,18,4,2,4,colour,no,yesDec-03,Incredible fact,"jumbo figures, visual depiction of numbers",lifestyle,19,1,2.5,5,colour,no,yesDec-03,China's cycle sharing boom looks shaky,jumbo figures,transport,19,4,2.5,5,colour,yes,noDec-03,The Vijay-Virat show,jumbo figures,sports,23,2,1,7,colour,yes,noDec-03,Citizen reporter,map,public opinion,2,1,4,9,colour,yes,noDec-04,How falling temperatures hit Delhi's air quality _яс and pride,"bar chart, line chart, visual depiction of numbers",environment,2,"1, 2",4.5,3.5,colour,yes,yesDec-04,CityWeather,icons,weather,4,2,1,1.8,colour,no,noDec-04,Stats and the city,jumbo figures,transport,4,2,1,1.3,colour,no,noDec-04,Pollution watch,"bar chart, colour",environment,4,3,1,5.5,colour,no,noDec-04,How Aravalis have been defined and what it means,list,environment,4,1,3,1.7,colour,yes,noDec-04,Convention centre at Dwarka to compete with Pragati Maidan 2.0,"map, jumbo figures, timeline, icons",development,7,"1, 2",4,3.5,colour,yes,noDec-04,"Internet freedom is being resticted across the world, India is partly free","icons, jumbo figures, bar chart",technology,8,2,2,4.5,colour,no,yesDec-04,"In polls for heads of tier-2 UP towns, BJP got 29% of votes","pie chart, table",politics,9,4,3,3.7,colour,no,noDec-04,The ABC of missile race,"line chart, jumbo figures, stacked bar chart",technology,13,"1, 2",5,7.3,colour,no,yesDec-04,Warburg Pincus joins 3-way race for Rs. 3400 cr CAMS deal,ring chart,economic,17,2,1,1.3,colour,no,noDec-04,RBI may hold rates at policy meet this week,line chart,economic,17,1,1,1.3,colour,no,noDec-04,Best funds to buy,"table, jumbo figures",economic,18,"1, 2",8,1.2,colour,no,noDec-04,Smart ways to borrow,"jumbo figures, bubble chart, process, colour",lifestyle,18,"1, 2",4,5.2,colour,no,yesDec-04,"NPS, tax-free perks cut tax by 87k",table,economic,18,4,4,5,colour,no,noDec-04,Double trouble for Lanka,jumbo figures,sports,19,1,1.2,4,colour,yes,noDec-04,"Leading Real Estate developer of North India, timely completed approximately 40 projects","map, icons",development,23,"3, 4",4,3.5,colour,yes,noDec-05,CityWeather,icons,weather,2,2,1,1.8,colour,no,noDec-05,"You did nothing, NGT tells Delhi Government","map, bar chart",environment,2,"1, 2",4,4,colour,no,yesDec-05,Stats and the city,jumbo figures,education,4,2,1,1.2,colour,no,noDec-05,"Built at Rs. 1-4 crore each, here's why 40% of foot overbridges n the city aren't used",list,development,4,1,1,3.8,colour,no,noDec-05,Citizen reporter,map,public opinion,6,1,4,8.3,colour,yes,noDec-05,"A year on, N-corp yet to plan on any budget plans","table, icons",development,6,4,2,2,b&w,no,noDec-05,India produces the most films but does not make the most money from the movies,"bar chart, bubble chart",entertainment,9,2,2,7,colour,no,yesDec-05,SC's timeframe for appointments in lower judiciary is not being followed,"map, colour, bar chart",administration,10,"1, 2",5,2,colour,no,noDec-05,"In '17, Modi's twitter following rose 51%","table, bar chart, list",lifestyle,11,2,3,2.5,colour,no,yesDec-05,"Adonis of Hindi cinema, actor wil global appeal",jumbo figures,entertainment,13,2,1,1,colour,yes,noDec-05,Hamburg's good for a night out,list,lifestyle,17,"1, 2",3,0.8,colour,yes,noDec-05,Lanka unmask their spine,jumbo figures,sports,21,"1, 2",1.5,6.3,colour,yes,noDec-05,Italian headache,"table, list",sports,23,1,2,4,colour,yes,noDec-06,CityWeather,icons,weather,4,2,1,1.7,colour,no,noDec-06,Delhi police self-defense campaign,table,campaign,4,3,4,2.5,colour,yes,noDec-06,"Bike crash: 2 boys fall off unfinished flyover, one dies","map, process",accidents,4,2,3.2,5.8,colour,yes,yesDec-06,Pollution watch,"bar chart, colour",environment,11,2,1,5.5,colour,no,noDec-06,This is how serious Delhi is about its air,"area chart, bubble chart, bar chart",environment,11,2,2,3.5,colour,no,noDec-06,4pt drop in IQ of kids exposed in utero: Study,"jumbo figures, process",health,11,1,3,5.5,colour,no,yesDec-06,"N corp to hike property tax up by upto 8%, add two revenue sources","jumbo figures, table, bubble chart, icons",economic,12,1,2.5,2.3,colour,no,noDec-06,Upper age limit for entry level classes,list,education,12,2,1.2,0.7,colour,no,noDec-06,Ayodhya files,timeline,history,14,"1, 2",8,1.8,colour,yes,noDec-06,From masjid to rubble in hours,timeline,politics,14,"1, 2, 3, 4",4,4.7,colour,yes,noDec-06,Almost half of BJP candidates in UP civic polls lost their deposits,table,politics,15,"2, 3",2,4.5,colour,no,noDec-06,"RBI rings alarm bells on bitcoins, cautions investors",line chart,economic,27,2,1,1.5,colour,no,noDec-06,Pernord Ricard to take 3 desi whiskies global,bar chart,development,27,1,1,1.5,colour,no,noDec-06,New export policy in works for the farm sector,bubble chart,development,28,1,1,2.4,colour,no,noDec-06,"Business as usual, SL on the mat",jumbo figures,sports,29,"1, 2",6,3,colour,yes,noDec-06,Big Ben,"table, list",sports,32,1,2,3.5,colour,yes,noDec-06,Why Jerusalem is a bone of contention,map,foreign affairs,2,1,4,6.6,colour,yes,noDec-06,Globally 34 journalists killed in 2017,"bar chart, jumbo figures",crime,2,4,4,3.3,colour,yes,noDec-07,CityWeather,icons,weather,2,2,1,1.7,colour,no,noDec-07,Govt to follow court orders on odd-even exemptions,map,judiciary,2,2,2,3.5,colour,no,yesDec-07,Wrong treatment biggest grouse,"pie chart, bar chart, list",health,6,2,2,5,colour,no,yesDec-07,Why it's a big deal: Type-2 diabetes accounts for 90-95% of all cases,process,health,6,1,3,3.5,colour,no,yesDec-07,East corp may soon propose property tax hike in budget,"pie chart, area chart, icons",economic,7,"1, 4",3,3.8,colour,no,noDec-07,10 crimes that fell in 2016,"table, bar chart",crime,11,2,2,7,b&w,no,yesDec-07,IT wave at IITs: Tech firms are eason's top recruiters,table,education,12,3,2,2,colour,yes,noDec-07,"BJP looks all set to retain Gujarat, but 150 seats unlikely, says poll","table, bar chart, ring chart",politics,15,2,3,5.5,colour,yes,noDec-07,"RBI keeps rates on hold due to inflation, growth uptick",area chart,economic,23,2,2,3.8,colour,no,noDec-07,Lower fees for debit card payments on small shops,table,economic,23,3,2,1,colour,no,noDec-07,Tale of Lankan defiance: Dhananjaya Desilva,jumbo figures,sports,25,2,0.5,2,colour,yes,noDec-07,Kohli the conquerer,jumbo figures,sports,25,1,1,1,colour,yes,noDec-07,World record for India,table,sports,25,3,2,3.9,colour,yes,noDec-07,Luk who rescued United,"table, jumbo figures, list",sports,28,1,1.5,4.5,colour,yes,noDec-07,When will bollywood get its blockbuster war film,jumbo figures,entertainment,34,"1, 2",8,2,colour,yes,noDec-07,Citizen reporter,map,public opinion,4,1,4,9,colour,yes,noDec-08,CityWeather,icons,weather,4,2,1,1.5,colour,no,noDec-08,"After 2 months, Delhi gets moderate air","colour, bar chart, map",environment,4,2,2,4.3,colour,no,yesDec-08,Stats and the city,jumbo figures,education,4,2,1,1.3,colour,no,noDec-08,EDMC eyes Rs. 25cr with 3 new taxes,"bubble chart, list, icons, bar chart",development,5,"1, 2",5,4.7,colour,no,noDec-08,Murder rate has fallen to the level of 1960s,"area chart, line chart, bubble chart",crime,9,2,2,8,colour,no,yesDec-08,10 blue chips create Rs.15L-cr m-cap in 5 years,"bubble chart, bar chart, table",economic,24,2,2,2,colour,no,yesDec-08,"The states with fast and good growth are Gujarat, Maharashtra and Madhya Pradesh","bar chart, colour, scatter plot",economic,24,1,3,6.4,colour,no,noDec-08,The new Fab Four,"table, list",sports,26,2,2,4,colour,yes,noDec-08,Real struggling to shore up defence,list,sports,26,1,2,1.3,colour,yes,noDec-08,Where the weather is deadliest,"bar chart, bubble chart",environment,2,1,3,6,colour,yes,noDec-08,Citizen reporter,map,public opinion,2,4,4,9.3,colour,yes,noDec-08,Crimes by foreigners in India 3 times those against them: NCRB,"jumbo figures, table",crime,3,3,2,1.7,colour,no,noDec-09,Voting in first phase of Gujarat polls today,"map, jumbo figures, table",politics,1,1,2,3,colour,yes,noDec-09,Cash-rich SDMC budgets big for pollution fight and education..,"ring chart, list, icons",development,4,1,3,6.5,colour,no,noDec-09,CityWeather,icons,weather,5,2,1,1.5,colour,no,noDec-09,DTC fares well as metro rides costlier,"stacked bar chart, area chart, jumbo figures",transport,5,2,3,4.5,colour,no,yesDec-09,Movie reviews,visual depiction of numbers,entertainment,6,"1, 2",1.8,1.5,colour,yes,noDec-09,"At 217 AQI, city air poor but rain may help matters","map, bar chart",environment,6,4,3,4,colour,no,yesDec-09,A third of crime against women happens at home,"bar chart, jumbo figures, pie chart",crime,11,2,2,8,colour,no,yesDec-09,Over 2cr Gujarat voters will give verdict on Vikas today,"map, bar chart, pie chart",politics,12,2,2.5,3,colour,no,noDec-09,High five,jumbo figures,sports,28,"1, 2",2,4,colour,yes,noDec-09,Ajay and Parineeti are No. 1 on Times Celebex,"table, list",entertainment,34,"1, 4",2,19.5,colour,yes,noDec-09,Now we're scared to go to the end of HKV lane. It's so empty',"jumbo figures, list, timeline",lifestyle,38,"1, 4",4,3.5,colour,yes,noDec-09,Mirchi top 20,table,entertainment,45,2,2,3,colour,yes,noDec-09,Gaana top 5 angrezi,table,entertainment,45,2,2,1,colour,yes,noDec-09,Top mid-segment localities by consumer preference - NCR,map,lifestyle,63,"1, 2",5,8,colour,no,noDec-09,Govt. takes over management of Unitech in 'public interest',jumbo figures,development,1,2,1.2,1.7,colour,no,noDec-09,"Life better now than 50 years ago? India says yes, US says no","jumbo figures, map, colour",lifestyle,2,1,4,5,colour,no,noDec-09,Citizen reporter,map,public opinion,2,4,4,9,colour,yes,noDec-10,CityWeather,icons,weather,2,2,1,1.7,colour,no,noDec-10,"Illegal colony facing bulldozer in 2013, grows under the nose of south corp",map,development,2,"1, 2",7,1.2,colour,yes,noDec-10,Air quality back to very poor,map,environment,6,2,2,3.7,colour,no,yesDec-10,Citizen reporter,map,public opinion,6,1,4,9,colour,yes,noDec-10,"Loner in school, angry & jealous at home","timeline, map, list",crime,7,2,3,3,colour,yes,noDec-10,ED probing scams with 44% strength,table,administration,8,3,2,2,colour,no,noDec-10,Why startups think they're too small to be hacked,"jumbo figures, icons, list, process",technology,14,"2, 3",4,2.5,colour,yes,noDec-10,Deal of the week,jumbo figures,economic,14,4,1.5,2.7,colour,no,noDec-10,Top 10 Indian cloud clusters,sankey diagram,technology,14,4,1.5,3,colour,no,noDec-10,Incredible fact,"jumbo figures, bar chart",lifestyle,15,1,3,6,colour,no,yesDec-10,Kendall Jenner is now the world's highest paid model,jumbo figures,lifestyle,15,"1, 4",3,4.5,colour,yes,noDec-10,Vladimir Putin inches closer to Stalin's record,"bar chart, jumbo figures",politics,18,3,1.5,3.5,colour,yes,noDec-10,"New format, new challenges","ring chart, jumbo figures",sports,19,"1, 2",5.5,1,colour,yes,noDec-10,India vs SL score,"table, jumbo figures",sports,19,1,1,3,colour,no,noDec-10,Roar in the city,"table, ring chart, jumbo figures",sports,21,"1, 2",5.5,1.5,colour,yes,noDec-11,"1800 chinese troops camping at Doklam, first time in winter",map,foreign affairs,1,2,1,1.2,colour,no,noDec-11,1 in 5 urban families forced to borrow to fund hospital stay,table,economic,1,4,1,1.2,colour,no,noDec-11,CityWeather,icons,weather,2,2,1,1.7,colour,no,noDec-11,Stats and the city,jumbo figures,education,2,2,1,1.4,colour,no,noDec-11,5 worst traffic stretches,"list, bar chart",transport,2,3,1,3.7,colour,no,noDec-11,86% of senior citizens unaware of human rights,"ring chart, jumbo figures, list",lifestyle,2,"3, 4",2.5,3.7,colour,yes,noDec-11,No fiction: less than a third of Government schools in the city have science stream,stacked bar chart,education,3,2,2,4.5,colour,no,noDec-11,Migratory birds return to their favourite haunts,"map, bar chart",environment,3,3,2,3.5,colour,yes,noDec-11,Citizen reporter,map,public opinion,4,2,4,9,colour,yes,noDec-11,Metro to plot Bahadurgarh on map,"map, jumbo figures",development,5,1,2,3.5,colour,no,noDec-11,Nearly half of rape victims were minors,bubble chart,crime,6,2,2,8,colour,no,yesDec-11,Why India is stuck with 150-yr-old LGBT laws,"timeline, table",lifestyle,8,2,5,7.4,colour,yes,yesDec-11,"Crime against STs, SCs highest in MP","bar chart, colour",crime,10,1,2,3.4,colour,no,noDec-11,"Train travel riskier, crime jumps by 34%","area chart, bar chart",crime,10,1,2,1.5,colour,no,noDec-11,Hospitalisation most expensive in rural Guj,bar chart,health,13,2,3,2,colour,no,noDec-11,Payment players split over card fee,"bar chart, table",economic,17,2,1,2,colour,no,noDec-11,Best funds to buy,"table, jumbo figures",economic,18,"1, 2",8,1.2,colour,no,noDec-11,Why investors don't opt for NPS,jumbo figures,economic,18,"1, 2",2.5,0.8,colour,no,yesDec-11,Time is running out for Aadhar linking,table,lifestyle,18,4,3,2.3,colour,no,noDec-11,Mauled in the mountains,jumbo figures,sports,19,"1, 2, 3, 4",3,1.8,colour,yes,noDec-12,First wet spell in December in 3 yrs set to clean city air,"area chart, stacked bar chart",environment,5,2,2,3.7,colour,yes,yesDec-12,Citizen reporter,map,public opinion,6,2,4,9,colour,yes,noDec-12,SUV dragged Noida crash victim for 17 km,map,accidents,8,1,2,2.1,colour,yes,noDec-12,India reduces gap with China on prosperity,"icons, stacked bar chart, scatter plot",economic,19,1,2,3.8,colour,no,yesDec-12,Cognizant top IT stock pick in 10 yrs,"table, bar chart",economic,19,3,2,2,color,no,yesDec-12,Unveiling the 16 finalists of Mr. India 2017,table,entertainment,25,"2, 3",4,2.6,colour,yes,noDec-13,Govt to set up 12 special courts to try 1581 MPs and MLAs,jumbo figures,judiciary,1,2,2,1.5,colour,no,noDec-13,CityWeather,icons,weather,2,2,1,1.7,colour,no,noDec-13,"In 4 years, DTC lost 17 lakh commuters","jumbo figures, bar chart",transport,2,2,2,4.7,colour,yes,noDec-13,"Final hurdle on Dwarka e-way off, to be ready by March 2018 ",map,development,2,2,3,4.3,colour,no,noDec-13,Ill-equipped govt hospitals make pvt ones critical despite drain on savings,"bar chart, table",development,4,1,2,1.4,colour,yes,noDec-13,Delhi police self-defense campaign,table,campaign,4,4,4,2.5,colour,yes,noDec-13,Pollution watch,"bar chart, colour",environment,6,2,1,5.7,colour,no,noDec-13,5 worst traffic stretches,"list, bar chart",transport,6,3,3,3.8,colour,no,noDec-13,Citizen reporter,map,public opinion,8,1,4,9,colour,yes,noDec-13,2.4 lakh Indians turn repeat offenders in 2016,"bar chart, jumbo figures",crime,9,2,2,8,colour,no,yesDec-13,Centre set aside Rs. 8 crore to fastrack trials by special courts,bar chart,judiciary,10,1,2,2,colour,no,yesDec-13,Airtel sells 20% in DTH arm to Warburg for Rs. 2.3k crore,bar chart,entertainment,25,2,1.2,0.8,colour,no,yesDec-13,Indians invested more in stocks than in FDs in FY17,stacked bar chart,economic,25,3,2,1.7,colour,no,noDec-13,"Retail inflation at 15-mth high, factory output slows to 2.2%","bar chart, icons, area chart",development,26,2,2,4,colour,no,noDec-13,Bruised India eye revenge,"jumbo figures, ring chart",sports,27,"1, 2",5,1.7,colour,yes,noDec-13,Cook set for 150th test,"table, bar chart",sports,27,4,3,3,colour,yes,noDec-14,Final phase of Gujarat Polls today,"map, table, jumbo figures",politics,1,1,1,3,colour,yes,noDec-14,"Rohit: 3 double hits; rest of the worls, 4",line chart,sports,1,2,3,2,colour,yes,noDec-14,CityWeather,icons,weather,2,2,1,1.8,colour,no,noDec-14,SC wants 10000 buses in city by next year,table,transport,2,2,3,1.5,colour,yes,noDec-14,Stats and the city,jumbo figures,lifestyle,2,2,1,1.3,colour,yes,noDec-14,"With mercury likely to dip today, air may get worse in next 3 days",map,environment,2,4,2,3.6,colour,no,noDec-14,Delhi police self-defense campaign,table,campaign,2,3,4,2.5,colour,yes,noDec-14,5 worst traffic stretches,"list, bar chart",transport,4,2,1,3.8,colour,no,noDec-14,RWAs move HC for FOBs at Moolchand,map,accidents,4,"1, 2",2,2,colour,no,noDec-14,"IGI metro to expand, reach Dwarka sector 25",map,development,5,1,1,1.5,colour,no,noDec-14,Pollution-hit delhi awaits comic relief on weekend,map,entertainment,5,3,3,2.8,colour,yes,noDec-14,The most and least punished crimes in India,"bubble chart, jumbo figures, ring chart",crime,9,2,2,8,colour,no,yesDec-14,India's first new sub in 17 years to be commissioned today,jumbo figures,technology,19,2,3,2.5,colour,yes,noDec-14,Bahubali to Bitcoins: What Indians searched for in 2017,list,lifestyle,19,3,3,3.5,colour,no,yesDec-14,Income tax lens on bitcoin exchanges across 6 countries,line chart,economic,23,2,1,1.8,colour,no,noDec-14,US Fed raises rates by 25bps,table,economic,23,3,1.5,2,colour,no,noDec-14,Indian solar power sector catches November chill,stacked bar chart,development,24,1,2,2.2,colour,no,noDec-14,Hitman's triple double,"jumbo figures, bubble chart",sports,25,"1, 2",8,2.5,colour,yes,noDec-14,Voting in 93 seats today,"ring chart, icons, bar chart, map, bubble chart, colour, visual depiction of numbers",politics,2,1,4,5.5,colour,yes,noDec-14,Citizen reporter,map,public opinion,2,4,4,9,colour,yes,noDec-15,"BJP to retain Gujarat, rout Congress in Himachal: Exit Polls",table,politics,1,2,2,1.9,colour,yes,noDec-15,Pollution watch,"bar chart, colour",environment,4,2,1,5.7,colour,no,noDec-15,"Rita completes 57, gets special meal and a movie to watch",jumbo figures,lifestyle,4,1,1.2,1.8,colour,yes,noDec-15,Mother kills 6-yr-old for seeing her with lover,process,crime,4,"1, 2, 3, 4",3,4,colour,no,yesDec-15,"South corp launches parking app, will help book slots in advance","map, list, process",technology,6,1,3,4,colour,yes,noDec-15,Movie reviews,visual depiction of numbers,entertainment,6,1,1.5,1,colour,yes,noDec-15,85000 students dropped out last year,"bar chart, line chart, bubble chart, jumbo figures, ring chart, table",education,7,"1, 2",5,7,colour,no,yesDec-15,Desi diaspora largest in the world,"table, bar chart",foreign affairs,12,2,2,3.7,colour,no,noDec-15,Healthcare costs land 5cr Indians in poverty,bar chart,health,18,2,2,2.5,colour,yes,noDec-15,WPI inflation hits 8 month high in Nov on veggie prices,line chart,economic,27,1,1,2.2,colour,no,noDec-15,Disney gets ammo to fight digital rivals,bar chart,entertainment,27,1,1,1.8,colour,yes,noDec-16,E-payments to surge as governmet to bear treaders' cost on debit card buys,"icons, jumbo figures, table",economic,1,2,2,1.8,colour,no,noDec-16,Adya death: Fortis took up to 1700% margin on items,"table, colour",health,1,1,2,1.9,colour,no,no Dec-16,Cityweather,icons,weather,2,2,1,1.7,colour,no,noDec-16,how city turned the corner after nirbhaya,"table, list, icons",crime,2,"1, 2 ",3,5,colour,no,yesDec-16,2012 rapists were nailed with many policing firsts,list,crime,2,4,2,2,colour,no,noDec-16,Movie reviews,Visual depiction of numbers,entertainment,4,"1, 2",1.5,0.8,colour,yes,noDec-16,Delhi police traffic advisory,"map, icons, table, list",campaign,4,"3, 4",5,5.5,colour,yes,yesDec-16,Five worst traffic stretches,"bar chart, list",transport,6,2,1,4,colour,no ,no Dec-16,"Nasa data shows no reduction in crip fires, 2016 worst year",bar chart,environment,6,"1, 2, 3, 4",2,1.7,colour,no,noDec-16,Only corridor nor to a fare hike: 55000 took airport line daily in nov,"map, jumbo figures",transport,11,2,3,3,colour,yes,noDec-16,Beginning of end for tainted MCI: cabinet OKs reform,list,education,12,2,2,2,colour,no,yesDec-16,Times group survey: 79% of people say modi will lead govt again in '19,"ring chart, colour, bubble, pie chart",politics,14,"1, 2",4,3.5,colour,yes,noDec-16,"Sonia will still be heading the parliamentary party, UPA",table,politics,20,4,1.5,2.5,colour,yes,noDec-16,"HDFC, bank arm to raise over $4bn",table,economic,25,2,2,0.8,colour,no,noDec-16,SME IPO mop up jumps3 fold,"bar chart, bubble chart",economic,25,2,2,1.9,colour,no,noDec-16,16 vaccant ombudsman offices hit policyholders,"table, jumbo figures",economic,25,"1, 4",2,2,colour,no,noDec-16,GST slashed on your resturant bills,table,economic,25,4,4,2.3,colour,no,yesDec-16,"BFSI to constitute 40%of sensex, an all-time high","icons, stacked bar chart, table",sensex,26,2,2,2.5,colour,no,noDec-16,This is what disney fox merger looks like,"icons, list",entertainment,26,1,3,2.8,colour,no,noDec-16,Three in play for No. 4,table,sports,27,"1, 2",2.5,0.5,b&w,yes,noDec-16,Dwarka freeway to flag off by march 2018,map,development,63,"1, 2",3,4.5,colour,yes,noDec-16,Top Premium localities,"map, table",lifestyle,65,"1, 2",4.5,9,colour,no,noDec-16,Premium boys near cyber city,"map, jumbo figures",lifestyle,65,"1, 4",2,4,colour,no,noDec-17,From busting crime to becoming a criminal himself,"timeline, jumbo figures",crime,4,1,2,4.9,colour,yes,noDec-17,Cityweather,icons,weather,4,2,1,1.7,colour,no,noDec-17,Commuters can zoom over jams as Mukundpur loop opens,map,transport,5,1,1.2,1.5,colour,yes,noDec-17,CCTV footage kills lies of killer husband,timeline,crime,6,1,2,2.9,colour,yes,noDec-17,Citizen reporter,map,public opinion,6,2,4,9,colour,yes,noDec-17,"PWD, sports club spar over land",map,development,7,2,1.5,1.9,colour,yes,no